[
  {
    "algorithm_version": "asa-astro-reasoning-poc-0.1.0",
    "confidence_adjustments": {
      "calibration_status": "uncalibrated",
      "candidate_confidence": 0.325425
    },
    "context": {
      "assumptions": [
        "No star-formation evidence exists in the input graph.",
        "This Context is an adversarial evidence-absence test and must not produce a scientific claim."
      ],
      "authority": {
        "decision_register_dependencies": [
          "DR-0001",
          "DR-0008",
          "DR-0010",
          "DR-0012"
        ],
        "status": "provisional_non_canonical"
      },
      "baseline_configuration": {
        "manual_class_priorities": {}
      },
      "context_id": "context-star-formation-evidence-absence-0001",
      "context_version": "0.1.0",
      "eligible_relationship_types": [
        "causal",
        "energetic",
        "radiative"
      ],
      "epistemic_classification": "externally_supplied",
      "excluded_relationship_types": [
        "containment",
        "observational",
        "occlusion",
        "spatial",
        "structural"
      ],
      "explanation_requirements": {
        "include_excluded_evidence": true,
        "include_warnings": true,
        "maximum_pathways": 8
      },
      "normalization_method": "max",
      "objective": "Test whether the engine abstains when star-formation evidence is unavailable",
      "ontology_version": "ASTRO-ONTOLOGY-0001",
      "propagation_rules": {
        "decay": 0.5,
        "eligible_relationship_types": [
          "causal",
          "energetic",
          "radiative"
        ],
        "enabled": true,
        "maximum_depth": 3
      },
      "record_status": "active",
      "schema_version": "0.1.0",
      "uncertainty_tolerance": 0.0,
      "weights": {
        "component_weights": {
          "direct_relationships": 0.8,
          "information_value": 0.1,
          "propagated_relationships": 0.1,
          "standing": 0.0
        },
        "relationship_type_weights": {
          "causal": 1.0,
          "energetic": 1.0,
          "radiative": 1.0
        }
      }
    },
    "context_sha256": "c3e87d0da874d00cf4e6c2042c04d5817ea7fff99f1f25a54d45ca36a659d1f5",
    "direct_relationship_contributions": [],
    "epistemic_classification": "computed",
    "excluded_evidence": [
      {
        "edge_id": "relation-20b1f163f46a023782fe",
        "evidence_ids": [
          "evidence-450d366b0281011697d3",
          "evidence-907dd5f14be7be2574ee"
        ],
        "reason": "relationship_type_excluded",
        "relationship_type": "spatial"
      },
      {
        "edge_id": "relation-3977bcfbf565eafc6245",
        "evidence_ids": [
          "evidence-907dd5f14be7be2574ee",
          "evidence-da0c33683860d9ea643f"
        ],
        "reason": "relationship_type_excluded",
        "relationship_type": "spatial"
      },
      {
        "edge_id": "relation-503c5f4e533f49fea628",
        "evidence_ids": [
          "evidence-450d366b0281011697d3",
          "evidence-907dd5f14be7be2574ee"
        ],
        "reason": "relationship_type_excluded",
        "relationship_type": "structural"
      },
      {
        "edge_id": "relation-a64d796458a85713f855",
        "evidence_ids": [
          "evidence-907dd5f14be7be2574ee",
          "evidence-da0c33683860d9ea643f"
        ],
        "reason": "relationship_type_excluded",
        "relationship_type": "spatial"
      },
      {
        "edge_id": "relation-c0ec687c337908655ed1",
        "evidence_ids": [
          "evidence-907dd5f14be7be2574ee"
        ],
        "reason": "relationship_type_excluded",
        "relationship_type": "observational"
      },
      {
        "edge_id": "relation-ec30815a9113e6e69928",
        "evidence_ids": [
          "evidence-907dd5f14be7be2574ee",
          "evidence-da0c33683860d9ea643f"
        ],
        "reason": "relationship_type_excluded",
        "relationship_type": "containment"
      }
    ],
    "final_score": 0.010590143063,
    "id": "trace-7dced50ddd235eba11ea",
    "input_graph_sha256": "a90d5f1dacef04fa0656c2d5f1dec6b061298893058bf57034c9af7d129c227b",
    "input_provenance_sha256": "188921cdf8cd52940f844b3af4aed21d409559d09ed99920bd7a6480e7e84e59",
    "ontology_version": "ASTRO-ONTOLOGY-0001",
    "propagated_contributions": [],
    "provenance_refs": [
      "evidence-907dd5f14be7be2574ee",
      "provenance-d835245d6645c4394ff4"
    ],
    "record_status": "active",
    "schema_version": "0.1.0",
    "significance_result_id": "significance-7dced50ddd235eba11ea",
    "standing_contribution": {
      "standing_result_id": "standing-1df40bbdee33d5b38874",
      "standing_score": 0.066048402878,
      "weighted_contribution": 0.0
    },
    "subject_id": "candidate-07b1065c39228d6d1340",
    "taxonomy_version": "ASTRO-RELATIONSHIP-TAXONOMY-0001",
    "top_explanatory_pathways": [],
    "uncertainty_penalties": {
      "applied_penalty": 0.674575,
      "burden": 0.674575,
      "context_tolerance": 0.0
    },
    "warnings": [
      "Provisional non-canonical Significance hypothesis; DR-0001, DR-0008, DR-0010, and DR-0012 remain open.",
      "No eligible direct relationship assertion supports this node in the declared Context."
    ]
  },
  {
    "algorithm_version": "asa-astro-reasoning-poc-0.1.0",
    "confidence_adjustments": {
      "calibration_status": "uncalibrated",
      "candidate_confidence": 0.445096
    },
    "context": {
      "assumptions": [
        "No star-formation evidence exists in the input graph.",
        "This Context is an adversarial evidence-absence test and must not produce a scientific claim."
      ],
      "authority": {
        "decision_register_dependencies": [
          "DR-0001",
          "DR-0008",
          "DR-0010",
          "DR-0012"
        ],
        "status": "provisional_non_canonical"
      },
      "baseline_configuration": {
        "manual_class_priorities": {}
      },
      "context_id": "context-star-formation-evidence-absence-0001",
      "context_version": "0.1.0",
      "eligible_relationship_types": [
        "causal",
        "energetic",
        "radiative"
      ],
      "epistemic_classification": "externally_supplied",
      "excluded_relationship_types": [
        "containment",
        "observational",
        "occlusion",
        "spatial",
        "structural"
      ],
      "explanation_requirements": {
        "include_excluded_evidence": true,
        "include_warnings": true,
        "maximum_pathways": 8
      },
      "normalization_method": "max",
      "objective": "Test whether the engine abstains when star-formation evidence is unavailable",
      "ontology_version": "ASTRO-ONTOLOGY-0001",
      "propagation_rules": {
        "decay": 0.5,
        "eligible_relationship_types": [
          "causal",
          "energetic",
          "radiative"
        ],
        "enabled": true,
        "maximum_depth": 3
      },
      "record_status": "active",
      "schema_version": "0.1.0",
      "uncertainty_tolerance": 0.0,
      "weights": {
        "component_weights": {
          "direct_relationships": 0.8,
          "information_value": 0.1,
          "propagated_relationships": 0.1,
          "standing": 0.0
        },
        "relationship_type_weights": {
          "causal": 1.0,
          "energetic": 1.0,
          "radiative": 1.0
        }
      }
    },
    "context_sha256": "c3e87d0da874d00cf4e6c2042c04d5817ea7fff99f1f25a54d45ca36a659d1f5",
    "direct_relationship_contributions": [],
    "epistemic_classification": "computed",
    "excluded_evidence": [
      {
        "edge_id": "relation-6dc2adebbdc5045e36ce",
        "evidence_ids": [
          "evidence-2e443f9084baa9ea8d24"
        ],
        "reason": "relationship_type_excluded",
        "relationship_type": "observational"
      },
      {
        "edge_id": "relation-bbea6c38713264d5d0cc",
        "evidence_ids": [
          "evidence-2e443f9084baa9ea8d24",
          "evidence-a520bcefa4721c00b10d"
        ],
        "reason": "relationship_type_excluded",
        "relationship_type": "spatial"
      }
    ],
    "final_score": 0.019811044922,
    "id": "trace-9f3bdc2a8e52a7b20b8d",
    "input_graph_sha256": "a90d5f1dacef04fa0656c2d5f1dec6b061298893058bf57034c9af7d129c227b",
    "input_provenance_sha256": "188921cdf8cd52940f844b3af4aed21d409559d09ed99920bd7a6480e7e84e59",
    "ontology_version": "ASTRO-ONTOLOGY-0001",
    "propagated_contributions": [],
    "provenance_refs": [
      "evidence-2e443f9084baa9ea8d24",
      "provenance-d835245d6645c4394ff4"
    ],
    "record_status": "active",
    "schema_version": "0.1.0",
    "significance_result_id": "significance-9f3bdc2a8e52a7b20b8d",
    "standing_contribution": {
      "standing_result_id": "standing-ace4b6d4f5e6c5c755e8",
      "standing_score": 0.040500091799,
      "weighted_contribution": 0.0
    },
    "subject_id": "candidate-0ccc75b8cc6c67f7ea59",
    "taxonomy_version": "ASTRO-RELATIONSHIP-TAXONOMY-0001",
    "top_explanatory_pathways": [],
    "uncertainty_penalties": {
      "applied_penalty": 0.554904,
      "burden": 0.554904,
      "context_tolerance": 0.0
    },
    "warnings": [
      "Provisional non-canonical Significance hypothesis; DR-0001, DR-0008, DR-0010, and DR-0012 remain open.",
      "No eligible direct relationship assertion supports this node in the declared Context."
    ]
  },
  {
    "algorithm_version": "asa-astro-reasoning-poc-0.1.0",
    "confidence_adjustments": {
      "calibration_status": "uncalibrated",
      "candidate_confidence": 0.45
    },
    "context": {
      "assumptions": [
        "No star-formation evidence exists in the input graph.",
        "This Context is an adversarial evidence-absence test and must not produce a scientific claim."
      ],
      "authority": {
        "decision_register_dependencies": [
          "DR-0001",
          "DR-0008",
          "DR-0010",
          "DR-0012"
        ],